[
  {
    "finding_id": "finding-security-blocker",
    "reviewer_id": "security",
    "severity": "BLOCKER",
    "claim": "The new token logging path can expose credentials in application logs.",
    "evidence": {
      "file_path": "src/auth/session.js",
      "line_start": 2,
      "line_end": 2,
      "snippet": "logger.info({ token: session.token });"
    },
    "impact": "A user session token could be captured by log aggregation and reused by compromised log readers.",
    "suggested_fix": "Remove the token field from the log payload or replace it with a non-sensitive token identifier.",
    "verification_test": "Add a test that creates a session and asserts the emitted log payload does not contain the raw token.",
    "confidence": "HIGH",
    "related_quality_rules": ["security.no_new_risk"],
    "tags": ["security"]
  },
  {
    "finding_id": "finding-security-question",
    "reviewer_id": "security",
    "severity": "QUESTION",
    "claim": "Should the raw token be present in the log payload for this session path?",
    "evidence": {
      "file_path": "src/auth/session.js",
      "line_start": 2,
      "line_end": 2,
      "snippet": "logger.info({ token: session.token });"
    },
    "impact": "If the token is intentionally logged, reviewers need evidence that the value is non-sensitive before accepting the risk.",
    "suggested_fix": "Clarify whether the logged token is raw sensitive data or replace it with a non-sensitive identifier.",
    "verification_test": "Add a test that asserts sensitive token values are not present in emitted log payloads.",
    "confidence": "LOW",
    "related_quality_rules": ["security.no_new_risk"],
    "tags": ["security"]
  }
]
